{"version":1,"ok":true,"request_id":"audit-acf-values-b4-20260906","action":"connector.batch","dry_run":true,"completed_at_gmt":"2026-09-06T21:51:38+00:00","data":{"operations":[{"action":"acf.get","result":{"target":1381,"fields":{"client":"GS Privechauffeur","category":"Private Driver","role":"WordPress webdesigner","link":"http:\/\/GS%20Privechauffeur%20presents%20chauffeur%20services%20stylishly%20and%20clearly%20for%20business%20and%20private%20journeys.","description_1":"GS Privechauffeur needed a private driver website that feels professional, clear and trustworthy from the first visit. Visitors had to understand the service, when to use it and how to request more information without unnecessary friction.","description_2":"I created a page structure with concise service information, clear benefits and visible contact options. The final WordPress page presents the private driver service in a calm and reliable way, making it easier for visitors to compare and enquire."},"fingerprint":"a1d08bec39c6b64a1f2206d5d03382d137d998abaebb06016de163cfaa9c4087"}},{"action":"acf.get","result":{"target":1383,"fields":{"client":"Businesssuites","category":"Office rental","role":"WordPress webdesigner","link":"https:\/\/businesssuites.nl","description_1":"Businesssuites had useful office-rental information, but the message needed a calmer structure and clearer priority. Visitors needed to scan the page, understand the practical value, and see a simple route forward. The content also had to sound specific instead of broad or interchangeable. It made the next step clearer sooner.","description_2":"I rewrote the content and organised the page so each section answers a clear visitor question. The result explains the office-rental work in plain English, connects benefits to real decisions, and keeps contact options close. This makes the case easier to read, compare, and trust. It made choices easier too."},"fingerprint":"d35242d77d3203fd86c367b5cdffd7195035b8ef16814ad71ec3152d103259a3"}},{"action":"acf.get","result":{"target":1384,"fields":{"client":"Ibtraject","category":"Engineering","role":"WordPress webdesigner","link":"https:\/\/ibtraject.nl","description_1":"Ibtraject needed a website that answers practical visitor questions faster. The engineering offer had to be explained with clear context, useful detail and a visible route to contact. Without a tighter structure, the page risked feeling generic and harder to judge on smaller screens.","description_2":"I refined the page by reducing repetition, improving the order of information and making each section easier to scan. The WordPress build presents the engineering offer with practical context and a steady flow, giving visitors clearer reasons to compare the work and start a conversation."},"fingerprint":"df15f498f6b5bfe928ec455add7741272631179fb86ab9795380b2a685f63b59"}},{"action":"acf.get","result":{"target":1390,"fields":{"client":"Monitorpolitiekeontwikkeling","category":"Politics","role":"WordPress webdesigner","link":"https:\/\/monitorpolitiekeontwikkeling.nl","description_1":"The politics page for Monitorpolitiekeontwikkeling needed to remove hesitation before inquiry. Visitors were likely comparing providers, so the page had to explain the work quickly, show relevant details, and keep the next step obvious. Long, general wording would have made the offer feel less certain. It made choices easier too.","description_2":"I created a more direct page flow with concise headings, specific project wording, and WordPress content fields that stay easy to maintain. The design gives Monitorpolitiekeontwikkeling a clearer presentation, while visitors can scan the work, understand the value, and move toward contact without confusion. It supported faster decisions before contact."},"fingerprint":"5565d407819cc39b1a6cc3ec1a9862f94fcb899ab3da812af9831317fc48bda2"}},{"action":"acf.get","result":{"target":1391,"fields":{"client":"Kroessvisser","category":"Finance","role":"WordPress webdesigner","link":"https:\/\/kroessvisser.nl","description_1":"Kroessvisser needed a finance page that removes hesitation before inquiry. Visitors were likely comparing providers, so the page had to explain the offer quickly, show relevant details and keep the next step clear. Long or general wording would have made the service feel less certain.","description_2":"I created a more direct page flow with concise headings, specific project wording and WordPress content fields that remain easy to maintain. The design gives Kroessvisser a clearer presentation, while visitors can scan the offer, understand the value and move towards contact without confusion."},"fingerprint":"69a5a12f99ff6ddab550fb022453c0c8cf959164adb6f81ca0ab84f76a9bb1fa"}},{"action":"acf.get","result":{"target":1392,"fields":{"client":"Superfruitmand","category":"Webshop","role":"WooCommerce developer","link":"https:\/\/superfruitmand.nl","description_1":"The need for an improved webshop was required for Superfruitmand as the visitors were unable to comprehend what Superfruitmand had to offer or what was in it for them. With more details regarding the projects being shown, there would be a better understanding of how Superfruitmand could be of use.","description_2":"I refined Superfruitmand with better WordPress architecture, more precise English writing, and a design that takes users from information to action without any distractions, along with enhanced project context for visitors evaluating the project prior to contacting them, superior structure, clear wording, and concise writing."},"fingerprint":"cf5481fa29e0f76f5688b7120947727563008fd95821be1570de48a1267530bc"}},{"action":"acf.get","result":{"target":1394,"fields":{"client":"Progress","category":"Recruitment","role":"WordPress webdesigner","link":"https:\/\/pro-gress.nl","description_1":"A progress that was needed in terms of the page content included making it more understandable and convenient for comparing options offered. The page needed to provide information on the recruitment process in an easily understandable manner, which at the same time would give a sufficient amount of information about the service and encourage contact.","description_2":"I structured the page based on the priority information that the visitors should have: the offer, the advantage, and what to do next. Concise sections, clearer writing style, and efficient WordPress distribution have facilitated the evaluation of the recruiting project. The page became more concrete, practical, and inquiry-friendly."},"fingerprint":"bf3732a7092d7db1d8a015f253f8bb14a29f9506258ff6c815c655d31e4b098f"}},{"action":"acf.get","result":{"target":1393,"fields":{"client":"Bedrijfsboekhouder","category":"Finance","role":"WordPress webdesigner","link":"https:\/\/bedrijfsboekhouder.com","description_1":"The website for Bedrijfsboekhouder had to show entrepreneurs that bookkeeping can be simpler and less stressful. Visitors needed to understand which tasks they could outsource, what collaboration looks like, and when professional support can help their business.","description_2":"The site is built around realistic questions entrepreneurs often have about administration, tax returns, and financial advice. The text is direct and guides visitors toward the next step: getting in touch for more information. This helps entrepreneurs see what is offered without having to compare everything themselves."},"fingerprint":"f5ebcdbef47399511a39219d21f8fd270796669724fc6ae77a03418391926289"}},{"action":"acf.get","result":{"target":1395,"fields":{"client":"PRO Metaal","category":"Recycling","role":"WordPress webdesigner","link":"https:\/\/pro-metaal.nl","description_1":"For the PRO Metaal recycling website, it was important to eliminate any uncertainty prior to an inquiry. The visitor was probably looking at various options, hence it was crucial that the work involved be stated clearly and the next step be made evident. Uncertainty would definitely have been reduced by concise and specific language used.","description_2":"I streamlined the page structure using succinct headings, precise terminology, and content fields from WordPress that would always be simple to update. This helped to give PRO Metaal a more professional image, while allowing users to easily view their portfolio, comprehend the benefits of their services, and then get in touch with them."},"fingerprint":"d5f879f7a82f49c1c849e59b338c80af5adfa89ae67db06c89ccb37778e70c90"}}]},"meta":{"request_fingerprint":"47792487a03822a5d069c6f4128ce977d91a2919fa74f22975753d4e5576eda6"}}