{"version":1,"ok":true,"request_id":"homepage-template-patch-e100000-retry-20260907","action":"elementor.patch_element","dry_run":false,"completed_at_gmt":"2026-09-07T01:18:12+00:00","data":{"post_id":4743,"element_id":"e100000","before_element":{"id":"e100000","elType":"container","settings":[],"elements":[],"isInner":false},"after_element":{"id":"e100000","elType":"container","settings":{"content_width":"boxed","boxed_width":{"unit":"px","size":1280,"sizes":[]},"background_background":"classic","background_color":"#1C1C1C","padding":{"unit":"rem","top":"4","right":"0","bottom":"6","left":"0","isLinked":false},"padding_tablet":{"unit":"rem","top":"4","right":"2","bottom":"4","left":"2","isLinked":false},"padding_mobile":{"unit":"rem","top":"3","right":"1","bottom":"3","left":"1","isLinked":false},"flex_direction":"column","flex_gap":{"column":"1","row":"1","isLinked":true,"unit":"rem","size":1},"_element_id":"process"},"elements":[{"id":"e100001","elType":"widget","settings":{"title":"MY WORKFLOW","header_size":"span","align":"center","typography_typography":"custom","typography_font_family":"Chivo","typography_font_size":{"unit":"px","size":13,"sizes":[]},"typography_font_weight":"800","typography_letter_spacing":{"unit":"px","size":0.7,"sizes":[]},"typography_text_transform":"uppercase","title_color":"#F9C221"},"elements":[],"widgetType":"heading"},{"id":"e100002","elType":"widget","settings":{"title":"From idea to a fast, maintainable WordPress website","header_size":"h2","align":"center","typography_typography":"custom","typography_font_family":"Chivo","typography_font_size":{"unit":"px","size":44,"sizes":[]},"typography_font_weight":"800","typography_line_height":{"unit":"em","size":1.12,"sizes":[]},"title_color":"#FFFFFF","typography_font_size_tablet":{"unit":"px","size":36,"sizes":[]},"typography_font_size_mobile":{"unit":"px","size":29,"sizes":[]}},"elements":[],"widgetType":"heading"},{"id":"e100003","elType":"widget","settings":{"editor":"<p>A clear process from strategy to long-term improvements.<\/p>","align":"center","text_color":"#FFFFFF","typography_typography":"custom","typography_font_family":"Poppins","typography_font_size":{"unit":"px","size":16,"sizes":[]},"typography_line_height":{"unit":"em","size":1.55,"sizes":[]}},"elements":[],"widgetType":"text-editor"},{"id":"e100050","elType":"container","settings":{"content_width":"full","container_type":"grid","grid_columns_grid":{"unit":"fr","size":2,"sizes":[]},"grid_columns_grid_tablet":{"unit":"fr","size":2,"sizes":[]},"grid_columns_grid_mobile":{"unit":"fr","size":1,"sizes":[]},"grid_gaps":{"column":"1","row":"1","isLinked":true,"unit":"rem","size":1}},"elements":[{"id":"e100101","elType":"container","settings":{"background_background":"classic","background_color":"#222222","border_border":"solid","border_width":{"unit":"px","top":"1","right":"1","bottom":"1","left":"1","isLinked":true},"border_color":"#3A3A3A","border_radius":{"unit":"px","top":"12","right":"12","bottom":"12","left":"12","isLinked":true},"padding":{"unit":"rem","top":"2","right":"2","bottom":"2","left":"2","isLinked":false},"flex_align_items":"center"},"elements":[{"id":"e100102","elType":"widget","settings":{"title":"01 \u00b7 Think first","header_size":"h3","align":"center","typography_typography":"custom","typography_font_family":"Chivo","typography_font_size":{"unit":"px","size":22,"sizes":[]},"typography_font_weight":"700","title_color":"#FFFFFF"},"elements":[],"widgetType":"heading"},{"id":"e100103","elType":"widget","settings":{"editor":"<p>I clarify what the website needs to achieve before deciding how it should be structured and built.<\/p>","align":"center","text_color":"#FFFFFF","typography_typography":"custom","typography_font_family":"Poppins","typography_font_size":{"unit":"px","size":15,"sizes":[]},"typography_line_height":{"unit":"em","size":1.55,"sizes":[]}},"elements":[],"widgetType":"text-editor"}],"isInner":true},{"id":"e100201","elType":"container","settings":{"background_background":"classic","background_color":"#222222","border_border":"solid","border_width":{"unit":"px","top":"1","right":"1","bottom":"1","left":"1","isLinked":true},"border_color":"#3A3A3A","border_radius":{"unit":"px","top":"12","right":"12","bottom":"12","left":"12","isLinked":true},"padding":{"unit":"rem","top":"2","right":"2","bottom":"2","left":"2","isLinked":false},"flex_align_items":"center"},"elements":[{"id":"e100202","elType":"widget","settings":{"title":"02 \u00b7 Structure clearly","header_size":"h3","align":"center","typography_typography":"custom","typography_font_family":"Chivo","typography_font_size":{"unit":"px","size":22,"sizes":[]},"typography_font_weight":"700","title_color":"#FFFFFF"},"elements":[],"widgetType":"heading"},{"id":"e100203","elType":"widget","settings":{"editor":"<p>I organize pages, content and user journeys so visitors can find what they need without friction.<\/p>","align":"center","text_color":"#FFFFFF","typography_typography":"custom","typography_font_family":"Poppins","typography_font_size":{"unit":"px","size":15,"sizes":[]},"typography_line_height":{"unit":"em","size":1.55,"sizes":[]}},"elements":[],"widgetType":"text-editor"}],"isInner":true},{"id":"e100301","elType":"container","settings":{"background_background":"classic","background_color":"#222222","border_border":"solid","border_width":{"unit":"px","top":"1","right":"1","bottom":"1","left":"1","isLinked":true},"border_color":"#3A3A3A","border_radius":{"unit":"px","top":"12","right":"12","bottom":"12","left":"12","isLinked":true},"padding":{"unit":"rem","top":"2","right":"2","bottom":"2","left":"2","isLinked":false},"flex_align_items":"center"},"elements":[{"id":"e100302","elType":"widget","settings":{"title":"03 \u00b7 Build carefully","header_size":"h3","align":"center","typography_typography":"custom","typography_font_family":"Chivo","typography_font_size":{"unit":"px","size":22,"sizes":[]},"typography_font_weight":"700","title_color":"#FFFFFF"},"elements":[],"widgetType":"heading"},{"id":"e100303","elType":"widget","settings":{"editor":"<p>I create clean WordPress setups that are fast, manageable and not overloaded with unnecessary plugins.<\/p>","align":"center","text_color":"#FFFFFF","typography_typography":"custom","typography_font_family":"Poppins","typography_font_size":{"unit":"px","size":15,"sizes":[]},"typography_line_height":{"unit":"em","size":1.55,"sizes":[]}},"elements":[],"widgetType":"text-editor"}],"isInner":true},{"id":"e100401","elType":"container","settings":{"background_background":"classic","background_color":"#222222","border_border":"solid","border_width":{"unit":"px","top":"1","right":"1","bottom":"1","left":"1","isLinked":true},"border_color":"#3A3A3A","border_radius":{"unit":"px","top":"12","right":"12","bottom":"12","left":"12","isLinked":true},"padding":{"unit":"rem","top":"2","right":"2","bottom":"2","left":"2","isLinked":false},"flex_align_items":"center"},"elements":[{"id":"e100402","elType":"widget","settings":{"title":"04 \u00b7 Improve continuously","header_size":"h3","align":"center","typography_typography":"custom","typography_font_family":"Chivo","typography_font_size":{"unit":"px","size":22,"sizes":[]},"typography_font_weight":"700","title_color":"#FFFFFF"},"elements":[],"widgetType":"heading"},{"id":"e100403","elType":"widget","settings":{"editor":"<p>I test, refine and adjust details so the final website feels stable, usable and ready to grow.<\/p>","align":"center","text_color":"#FFFFFF","typography_typography":"custom","typography_font_family":"Poppins","typography_font_size":{"unit":"px","size":15,"sizes":[]},"typography_line_height":{"unit":"em","size":1.55,"sizes":[]}},"elements":[],"widgetType":"text-editor"}],"isInner":true}],"isInner":true}],"isInner":false},"rollback_request_id":"homepage-template-patch-e100000-retry-20260907"},"meta":{"request_fingerprint":"cdbbd7b66e19842a2ce6a6db91e1bd5962f959d76e20ca1a1dcd2a0f2c387bf6"}}