{"version":1,"ok":true,"request_id":"audit-acf-field-schema-4470-20260906","action":"acf.field_groups","dry_run":true,"completed_at_gmt":"2026-09-06T21:40:29+00:00","data":{"field_groups":[{"key":"group_69deb89e918e3","title":"Portfolio","fields":[{"key":"field_69deb8a3bcd88","name":"","label":"Tab 1","type":"tab","required":false},{"key":"field_69deb8b3bcd89","name":"client","label":"Client","type":"text","required":false},{"key":"field_69deb8c0bcd8a","name":"category","label":"Category","type":"text","required":false},{"key":"field_69deb8cebcd8b","name":"role","label":"Role","type":"text","required":false},{"key":"field_69eba2ddebee1","name":"link","label":"Link","type":"url","required":false},{"key":"field_69deb8d2bcd8c","name":"","label":"Tab 2","type":"tab","required":false},{"key":"field_69deb8ddbcd8d","name":"description_1","label":"Description 1","type":"wysiwyg","required":false},{"key":"field_69deb8e4bcd8e","name":"description_2","label":"Description 2","type":"wysiwyg","required":false},{"key":"field_69deb8f5bcd8f","name":"","label":"Tab 3","type":"tab","required":false},{"key":"field_69eb8f89143db","name":"afbeelding_1","label":"Afbeelding 1","type":"image","required":false},{"key":"field_69eb8f92143dc","name":"afbeelding_2","label":"Afbeelding 2","type":"image","required":false},{"key":"field_69eb8f95143dd","name":"afbeelding_3","label":"Afbeelding 3","type":"image","required":false},{"key":"field_69eb8f96143de","name":"afbeelding_4","label":"Afbeelding 4","type":"image","required":false}]}]},"meta":{"request_fingerprint":"9eaba8e17ee3fcaf9cde72c3e8ce8d58aa73063cd0801f4cce3595eb741c0f0d"}}